{
  "execute_on": "lxc",
  "name": "Install Packages",
  "description": "Install packages inside the LXC container. Supports both Alpine Linux (apk) and Debian/Ubuntu (apt) package managers.",
  "parameters": [
    {
      "id": "packages",
      "name": "Packages",
      "type": "string",
      "required": true,
      "description": "Space-separated list of packages to install. For Alpine Linux, use APK package names. For Debian/Ubuntu, use apt package names."
    },
    {
      "id": "ostype",
      "name": "OS Type",
      "type": "string",
      "default": "alpine",
      "advanced": true,
      "description": "Operating system type: 'alpine' for Alpine Linux (apk) or 'debian'/'ubuntu' for Debian/Ubuntu (apt)."
    }
  ],
  "commands": [
    {
      "script": "install-apk-package.sh",
      "description": "Install packages using the appropriate package manager (apk for Alpine, apt for Debian/Ubuntu)"
    }
  ]
}







