{
  "execute_on": "ve",
  "name": "Set homeassistant DB params",
  "description": "Set parameters for MariaDB user and database creation",
 
  "commands": [
    {
      "command": "echo '[{\"id\":\"db_user\",\"value\":\"homeassistant\"},{\"id\":\"db_password\",\"value\":\"homeassistant\"},{\"id\":\"db_name\",\"value\":\"homeassistant\"}]'"
    }
  ],
  "outputs": [
    { "id": "db_user" },
    { "id": "db_password" },
    { "id": "db_name" }
  ]
}
