{
  "execute_on": "lxc",
  "name": "Enable Community Packages",
  "description": "Enable Alpine Linux community repository for additional packages",
  "commands": [
    {
      "script": "enable-community-packages.sh",
      "description": "Enable community repository in /etc/apk/repositories"
    }
  ]
}
