{
  "execute_on": "ve",
  "name": "Modbus2Mqtt Parameters",
  "description": "Set application-specific parameters for Modbus2Mqtt",
  "parameters": [
    {
      "id": "hostname",
      "name": "OS Hostname",
      "type": "string",
      "default": "modbus2mqtt",
      "required": true,
      "description": "Hostname for the Modbus2Mqtt OS"
    },
    {
      "id": "username",
      "name": "OS Username",
      "type": "string",
      "default": "modbus2mqtt",
      "required": true,
      "advanced": true,
      "description": "Username for the Modbus2Mqtt OS"
    }, 
    {
      "id": "storage_selection",
      "name": "Storage Selection",
      "type": "enum",
      "required": false,
      "enumValuesTemplate": "list-available-storage.json",
      "description": "Select storage to mount. Volumes will be created at <host_mountpoint>/volumes/<hostname>/<volume-key>. If not provided, volumes will be created under /mnt/volumes/<hostname>/<volume-key>.",
      "advanced": true
    },
    {
      "id": "uid",
      "name": "UID",
      "type": "string",
      "default": "1000",
      "description": "UID for the user and mount permissions. Will be used consistently on VE host and LXC container.",
      "advanced": true
    },
    {
      "id": "gid",
      "name": "GID",
      "type": "string",
      "default": "1000",
      "description": "GID for the user and mount permissions. Will be used consistently on VE host and LXC container.",
      "advanced": true
    }
  ],
  "commands": [
    {
      "properties": [
        { "id": "ostype", "value": "alpine" },
        { "id": "volumes", "value": "data=/data\nconfig=/config\nssl=/ssl" },
        { "id": "packages", "value": "nodejs npm git openrc" }
      ]
    }
  ]
}
