{
  "name": "Create volumes on lxc-Host",
  "description": "Creates a host-specific volumes directory that is not bound to any container.\n\nThe directory structure is: <mountpoint>/volumes/<hostname>\n\nThis directory can be used for Docker volumes or other host-specific data that needs to persist independently of container bind mounts.\n\nThis template can be called independently and is safe to call multiple times (idempotent).",
  "execute_on": "ve",
  "parameters": [
    {
      "id": "mountpoint",
      "name": "Mount point base path",
      "type": "string",
      "required": true,
      "description": "Base mount point path. The volumes directory will be created at <mountpoint>/volumes/<hostname>."
    },
    {
      "id": "hostname",
      "name": "Container hostname",
      "type": "string",
      "required": true,
      "description": "Hostname of the container. Used to create a unique volumes directory per container."
    },
    {
      "id": "uid",
      "name": "UID for volumes directory",
      "type": "string",
      "required": false,
      "advanced": true,
      "description": "Optional: UID to set for the volumes directory. If not provided, default permissions will be used."
    },
    {
      "id": "gid",
      "name": "GID for volumes directory",
      "type": "string",
      "required": false,
      "advanced": true,
      "description": "Optional: GID to set for the volumes directory. If not provided, default permissions will be used."
    }
  ],
  "outputs": [
    {
      "id": "host_path"
    }
  ],
  "commands": [
    {
      "script": "bind-volumes.sh",
      "description": "Executes the script to create the volumes directory on the host."
    }
  ]
}



